{
  "properties": {
    "name": "Simple Project",
    "author": "Mock User",
    "startDate": "2025-01-02",
    "finishDate": "2025-01-05",
    "currentDate": "2025-01-02",
    "taskCount": 3,
    "resourceCount": 1,
    "assignmentCount": 3
  },
  "tasks": [
    { "id": 1, "uniqueID": 1, "name": "Task 1", "outlineNumber": "1", "outlineLevel": 1, "start": "2025-01-02", "finish": "2025-01-03", "duration": "1d", "work": 8, "percentComplete": 0 },
    { "id": 2, "uniqueID": 2, "name": "Task 2", "outlineNumber": "2", "outlineLevel": 1, "start": "2025-01-03", "finish": "2025-01-04", "duration": "1d", "work": 8, "percentComplete": 0 },
    { "id": 3, "uniqueID": 3, "name": "Task 3", "outlineNumber": "3", "outlineLevel": 1, "start": "2025-01-04", "finish": "2025-01-05", "duration": "1d", "work": 8, "percentComplete": 0 }
  ],
  "resources": [
    { "id": 1, "uniqueID": 1, "name": "Resource A", "type": "Work", "maxUnits": 1 }
  ],
  "assignments": [
    { "taskID": 1, "resourceID": 1, "units": 1 },
    { "taskID": 2, "resourceID": 1, "units": 1 },
    { "taskID": 3, "resourceID": 1, "units": 1 }
  ]
}
